{
  "name": "ContactPage",
  "type": "pattern",
  "description": "Customer inquiry and lead capture page utilizing the preserved ContactForm component",
  "layout": "ApplicationShell",
  "components": [
    "PDSHeader",
    "ContactForm",
    "PDSCard"
  ],
  "compositionRules": [
    "Place PDSHeader with page title and support description",
    "Render ContactForm inside a centered container or PDSCard",
    "Include phone field toggle if customer support context requires phone callbacks"
  ],
  "samplePayload": {
    "title": "Contact Our Team",
    "headline": "Send us a message and our engineers will get back to you promptly",
    "showPhoneField": true
  }
}
